[
  {
    "id": "365manga",
    "label": "365Manga",
    "url": "https://365manga.com",
    "template": "wordpress-madara",
    "tags": [
      "webtoon",
      "english"
    ],
    "origin": "bundled"
  },
  {
    "id": "mangalover",
    "label": "3asq (مانجا العاشق)",
    "url": "https://3asq.org",
    "template": "wordpress-madara",
    "tags": [
      "manga",
      "arabic"
    ],
    "origin": "bundled"
  },
  {
    "id": "8musesxxx",
    "label": "8 MUSES XXX",
    "url": "https://8muses.xxx",
    "template": "wordpress-madara",
    "tags": [
      "hentai",
      "english"
    ],
    "nsfw": true,
    "origin": "bundled"
  },
  {
    "id": "acescans",
    "label": "Ace Scans",
    "url": "https://acescans.xyz",
    "template": "wordpress-mangastream",
    "tags": [
      "manga",
      "english"
    ],
    "path": "/manga/list-mode/",
    "origin": "bundled"
  },
  {
    "id": "akumanga",
    "label": "AkuManga",
    "url": "https://akumanga.com",
    "template": "wordpress-madara",
    "tags": [
      "webtoon",
      "arabic"
    ],
    "origin": "bundled"
  },
  {
    "id": "allporncomic",
    "label": "AllPornComic",
    "url": "https://allporncomic.com",
    "template": "wordpress-madara",
    "tags": [
      "hentai",
      "porn",
      "english"
    ],
    "nsfw": true,
    "origin": "bundled"
  },
  {
    "id": "alphascans",
    "label": "Alpha Scans",
    "url": "https://alpha-scans.org",
    "template": "wordpress-mangastream",
    "tags": [
      "webtoon",
      "english"
    ],
    "path": "/manga/list-mode/",
    "origin": "bundled"
  },
  {
    "id": "anikiga",
    "label": "Anikiga",
    "url": "https://anikiga.com",
    "template": "wordpress-madara",
    "tags": [
      "manga",
      "turkish"
    ],
    "origin": "bundled"
  },
  {
    "id": "animaregia",
    "label": "Anima Regia",
    "url": "https://animaregia.net",
    "template": "mangareader-cms",
    "tags": [
      "manga",
      "webtoon",
      "portuguese"
    ],
    "language": "pt",
    "origin": "bundled"
  },
  {
    "id": "anitationarts",
    "label": "Anitation Arts",
    "url": "https://anitationarts.org",
    "template": "wordpress-mangastream",
    "tags": [
      "manga",
      "english"
    ],
    "path": "/manga/?list",
    "origin": "bundled"
  },
  {
    "id": "antisensescans",
    "label": "AntisenseScans",
    "url": "http://antisensescans.com",
    "template": "foolslide",
    "tags": [
      "manga",
      "high-quality",
      "english",
      "scanlation"
    ],
    "path": "/online/directory/",
    "language": "english",
    "origin": "bundled"
  },
  {
    "id": "anubisscans",
    "label": "Anubis Scans",
    "url": "https://anubisscans.com",
    "template": "wordpress-madara",
    "tags": [
      "webtoon",
      "turkish"
    ],
    "origin": "bundled"
  },
  {
    "id": "anzmanga",
    "label": "AnzManga",
    "url": "https://www.anzmangashd.com",
    "template": "mangareader-cms",
    "tags": [
      "manga",
      "spanish"
    ],
    "language": "es",
    "origin": "bundled"
  },
  {
    "id": "komikav",
    "label": "APKomik",
    "url": "https://apkomik.cc",
    "template": "wordpress-mangastream",
    "tags": [
      "manga",
      "indonesian"
    ],
    "path": "/manga/list-mode/",
    "origin": "bundled"
  },
  {
    "id": "apollcomics",
    "label": "Apoll Comics",
    "url": "https://apollcomics.xyz",
    "template": "wordpress-madara",
    "tags": [
      "webtoon",
      "spanish"
    ],
    "origin": "bundled"
  },
  {
    "id": "apolltoons",
    "label": "Apolltoons",
    "url": "https://apolltoons.xyz",
    "template": "wordpress-madara",
    "tags": [
      "webtoon",
      "spanish"
    ],
    "origin": "bundled"
  },
  {
    "id": "arcanescans",
    "label": "Arcane Scans",
    "url": "https://arcanescans.com",
    "template": "wordpress-madara",
    "tags": [
      "manga",
      "english",
      "webtoon",
      "scanlation"
    ],
    "origin": "bundled"
  },
  {
    "id": "aresmanga",
    "label": "Ares Manga",
    "url": "https://fl-ares.com",
    "template": "wordpress-mangastream",
    "tags": [
      "webtoon",
      "arabic"
    ],
    "path": "/series/list-mode/",
    "origin": "bundled"
  },
  {
    "id": "arthurscan",
    "label": "Arthur Scan",
    "url": "https://arthurscan.xyz",
    "template": "wordpress-madara",
    "tags": [
      "manga",
      "webtoon",
      "portuguese"
    ],
    "origin": "bundled"
  },
  {
    "id": "astralmanga",
    "label": "Astral-manga",
    "url": "https://astral-manga.fr",
    "template": "wordpress-madara",
    "tags": [
      "manga",
      "webtoons",
      "french"
    ],
    "origin": "bundled"
  },
  {
    "id": "atikrost",
    "label": "Atikrost",
    "url": "https://atikrost.com",
    "template": "wordpress-madara",
    "tags": [
      "manga",
      "high-quality",
      "turkish"
    ],
    "language": "tr",
    "origin": "bundled"
  },
  {
    "id": "azuremanga",
    "label": "Azure Manga",
    "url": "https://azuremanga.com",
    "template": "wordpress-mangastream",
    "tags": [
      "webtoon",
      "english"
    ],
    "path": "/manga/list-mode/",
    "origin": "bundled"
  },
  {
    "id": "bananascan",
    "label": "Banana Scan",
    "url": "https://banana-scan.com",
    "template": "wordpress-mangastream",
    "tags": [
      "manga",
      "english"
    ],
    "path": "/manga/list-mode/",
    "origin": "bundled"
  },
  {
    "id": "bestmanhua",
    "label": "Best Manhua",
    "url": "https://bestmanhua.com",
    "template": "wordpress-madara",
    "tags": [
      "webtoon",
      "english"
    ],
    "overrides": {
      "queryPages": "ul.blocks-gallery-grid li.blocks-gallery-item figure source"
    },
    "origin": "bundled"
  },
  {
    "id": "blmanhwaclub",
    "label": "BL Manhwa Club",
    "url": "https://blmanhwa.club",
    "template": "wordpress-madara",
    "tags": [
      "webtoon",
      "portuguese"
    ],
    "origin": "bundled"
  },
  {
    "id": "bokugents",
    "label": "Bokugen Translations",
    "url": "https://bokugents.com",
    "template": "wordpress-madara",
    "tags": [
      "webtoon",
      "spanish",
      "manga",
      "scanlation"
    ],
    "origin": "bundled"
  },
  {
    "id": "chibimanga",
    "label": "ChibiManga",
    "url": "https://www.cmreader.info",
    "template": "wordpress-madara",
    "tags": [
      "manga",
      "high-quality",
      "english",
      "scanlation"
    ],
    "origin": "bundled"
  },
  {
    "id": "cizgiromanarsivi",
    "label": "Çizgi Roman Arşivi (CizgiRomanArsivi)",
    "url": "https://cizgiromanarsivi.com",
    "template": "wordpress-madara",
    "tags": [
      "manga",
      "webtoon",
      "turkish"
    ],
    "origin": "bundled"
  },
  {
    "id": "cocorip",
    "label": "CocoRip",
    "url": "https://cocorip.net",
    "template": "wordpress-madara",
    "tags": [
      "manga",
      "spanish",
      "webtoon"
    ],
    "origin": "bundled"
  },
  {
    "id": "comicsvalley",
    "label": "Comics Valley",
    "url": "https://comicsvalley.com",
    "template": "wordpress-madara",
    "tags": [
      "porn",
      "english"
    ],
    "nsfw": true,
    "origin": "bundled"
  },
  {
    "id": "copypastescan",
    "label": "Copy & Paste Scan",
    "url": "https://copypastescan.xyz",
    "template": "wordpress-madara",
    "tags": [
      "manga",
      "webtoon",
      "high-quality",
      "spanish",
      "scanlation"
    ],
    "origin": "bundled"
  },
  {
    "id": "culturedworks",
    "label": "CulturedWorks",
    "url": "https://culturedworks.com",
    "template": "wordpress-mangastream",
    "tags": [
      "webtoon",
      "english",
      "scanlation"
    ],
    "path": "/manga/list-mode/",
    "origin": "bundled"
  },
  {
    "id": "deathtollscans",
    "label": "DeathTollScans",
    "url": "https://reader.deathtollscans.net",
    "template": "foolslide",
    "tags": [
      "manga",
      "high-quality",
      "english",
      "scanlation"
    ],
    "language": "english",
    "origin": "bundled"
  },
  {
    "id": "decadencescans",
    "label": "Decadence",
    "url": "https://reader.decadencescans.com",
    "template": "wordpress-madara",
    "tags": [
      "manga",
      "webtoon",
      "english"
    ],
    "origin": "bundled"
  },
  {
    "id": "deliscan",
    "label": "Deliscan",
    "url": "https://deliscan.xyz",
    "template": "wordpress-madara",
    "tags": [
      "webtoon",
      "french"
    ],
    "origin": "bundled"
  },
  {
    "id": "diamondfansub",
    "label": "DiamondFansub",
    "url": "https://diamondfansub.com",
    "template": "wordpress-madara",
    "tags": [
      "webtoon",
      "turkish"
    ],
    "origin": "bundled"
  },
  {
    "id": "disasterscans",
    "label": "Disaster Scans",
    "url": "https://disasterscans.com",
    "template": "wordpress-madara",
    "tags": [
      "webtoon",
      "high-quality",
      "english",
      "scanlation"
    ],
    "overrides": {
      "queryMangas": "div.post-title h3 a:last-of-type, div.post-title h5 a:last-of-type"
    },
    "origin": "bundled"
  },
  {
    "id": "doujin69",
    "label": "Doujin69",
    "url": "https://doujin69.com",
    "template": "wordpress-mangastream",
    "tags": [
      "webtoon",
      "hentai",
      "thai"
    ],
    "path": "/doujin/list-mode/",
    "nsfw": true,
    "origin": "bundled"
  },
  {
    "id": "doujinku",
    "label": "Doujinku",
    "url": "https://doujinku.xyz",
    "template": "wordpress-mangastream",
    "tags": [
      "manga",
      "hentai",
      "indonesian"
    ],
    "path": "/manga/list-mode/",
    "nsfw": true,
    "origin": "bundled"
  },
  {
    "id": "dragontea",
    "label": "Dragon Tea Scans",
    "url": "https://dragontea.ink",
    "template": "wordpress-madara",
    "tags": [
      "webtoon",
      "english"
    ],
    "origin": "bundled"
  },
  {
    "id": "drakescans",
    "label": "DrakeScans",
    "url": "https://drakecomic.org",
    "template": "wordpress-mangastream",
    "tags": [